{
  "site": "template",
  "base_url": "http://34.124.244.233/template",
  "api_base_path": "/api/web-manager",
  "api_secret_ref": "secret://grayson/sites/template",
  "managed_collections": ["pages", "posts", "services"],
  "allowed_capabilities": [
    "auth:verify",
    "status:read",
    "pages:write",
    "posts:write",
    "services:write",
    "globals:write",
    "media:write",
    "approval:write",
    "publish:write",
    "search:read",
    "revalidate:write"
  ],
  "environment": "production",
  "transport_aliases": ["/api/serena"],
  "policy": {
    "publish_requires_approval": true,
    "allow_global_updates": true,
    "allow_media_uploads": true
  }
}
